{
  "mode": "decide",
  "headline_kind": "decision",
  "headline": "Ship {arm:atlas-m} on all traffic. It is the only candidate that clears every gate.",
  "lede": "Cheaper models win two of the five tasks, but routing traffic to them is blocked: both fail the speculation gate, and speculation bait shows up inside every task. Once a cheaper model clears that gate, routing would cut cost.",
  "decision": {
    "slots": [
      {
        "key": "recommendation",
        "text": "**{arm:atlas-m} everywhere.** It passes the quality floor, every task-specific behavior and the latency budget on all five tasks.",
        "caveats": []
      },
      {
        "key": "why_not",
        "text": "**{arm:atlas-l}** has the best quality but misses the latency budget on four of five tasks. **{arm:brisk-s}** and **{arm:open-70b}** speculate too often on bait prompts to pass the speculation gate.",
        "caveats": []
      },
      {
        "key": "watch",
        "text": "The weakest margin: {arm:atlas-m}'s issue resolution in troubleshooting sits right at its floor, with an interval that crosses it. Re-test it on a larger troubleshooting sample before launch.",
        "caveats": []
      },
      {
        "key": "next",
        "text": "Test a speculation guard on {arm:brisk-s}. If it clears the speculation gate, route billing to {arm:brisk-s} and small talk to {arm:open-70b}, and the recommendation changes from one model to a routing plan.",
        "caveats": []
      }
    ],
    "confidence": {
      "form": "low",
      "caveats": []
    }
  },
  "method": [
    {
      "term": "Test set",
      "text": "Conversations sampled from September production logs and stratified by task. Speculation bait is a test category, not a traffic segment.",
      "caveats": []
    },
    {
      "term": "Grading",
      "text": "Overall quality is a rubric score from a judge calibrated against {judged.overall.calibration_ratings|int} human-graded conversations (agreement {judged.overall.agreement|pct}). Behaviors are graded pass or fail per conversation.",
      "caveats": []
    },
    {
      "term": "Intervals",
      "text": "Normal intervals; behavior rates use the binomial standard error.",
      "caveats": []
    },
    {
      "term": "Cost",
      "text": "Measured tokens times list price per thousand conversations; blended cost weights tasks by September traffic.",
      "caveats": []
    }
  ],
  "schema": "report-plan/1",
  "signals": {
    "candidate_structure": "unordered",
    "baseline": "none",
    "score_type": "mixed",
    "strata": "tasks",
    "criteria": "hard_gates",
    "cross_cutting": [
      "specul"
    ],
    "log_cost_axis": false
  },
  "shape": "A",
  "masthead": {
    "kind": "Choice · candidates compared",
    "system": "Concierge chat assistant",
    "counts": "4 arms · 5 tasks",
    "run_date": "{meta.run_date}",
    "synthetic": true
  },
  "arms": [
    {
      "id": "atlas-l",
      "color_slot": 0
    },
    {
      "id": "atlas-m",
      "color_slot": 1
    },
    {
      "id": "brisk-s",
      "color_slot": 2
    },
    {
      "id": "open-70b",
      "color_slot": 3
    }
  ],
  "show_arms_key": false,
  "flag": [],
  "options": {
    "rows": [
      {
        "option": "atlas-m",
        "role": "recommended"
      },
      {
        "option": "atlas-l",
        "role": "most_accurate"
      },
      {
        "option": "brisk-s",
        "role": "cheapest"
      },
      {
        "option": "open-70b",
        "role": "alternative"
      }
    ],
    "columns": [
      "gate"
    ]
  },
  "summary": [
    {
      "kind": "bars",
      "title": "Cost per thousand conversations, billing",
      "query": {
        "source": "tasks",
        "aspect": "",
        "measures": [
          "cost_per_1k"
        ],
        "arms": [
          "atlas-m",
          "atlas-l",
          "brisk-s",
          "open-70b"
        ],
        "strata": [
          "billing"
        ],
        "limit": 0,
        "transform": "none",
        "small_multiples_by": "none"
      },
      "reference": [],
      "emphasis": "atlas-m",
      "level": "",
      "unit": "",
      "domain": []
    }
  ],
  "sections": [
    {
      "id": "matrix",
      "eyebrow": "Where each candidate passes",
      "headline": "{arm:atlas-m} passes every task; the cheapest passing model differs by task",
      "takeaway": "Each cell checks overall quality, every task-specific behavior against its floor, and p-ninety-five latency. Amber means the score clears the floor but its interval crosses it.",
      "chart": {
        "kind": "gate_matrix",
        "title": "",
        "query": {
          "source": "tasks",
          "aspect": "",
          "measures": [
            "overall"
          ],
          "arms": [
            "atlas-m",
            "atlas-l",
            "brisk-s",
            "open-70b"
          ],
          "strata": [],
          "limit": 0,
          "transform": "none",
          "small_multiples_by": "none"
        },
        "reference": [],
        "emphasis": "atlas-m",
        "level": "",
        "unit": "",
        "domain": []
      },
      "caption": "",
      "caveats": []
    },
    {
      "id": "behaviors",
      "eyebrow": "Task-specific behaviors",
      "headline": "The small models fail on behaviors, not on overall quality",
      "takeaway": "Declining to speculate on bait prompts, with intervals; the floor is the dashed line.",
      "chart": {
        "kind": "dot_interval",
        "title": "",
        "query": {
          "source": "tasks",
          "aspect": "",
          "measures": [
            "declines"
          ],
          "arms": [
            "atlas-m",
            "atlas-l",
            "brisk-s",
            "open-70b"
          ],
          "strata": [
            "specul"
          ],
          "limit": 0,
          "transform": "none",
          "small_multiples_by": "none"
        },
        "reference": [],
        "emphasis": "",
        "level": "",
        "unit": "",
        "domain": []
      },
      "caption": "",
      "caveats": []
    },
    {
      "id": "latency",
      "eyebrow": "Latency",
      "headline": "{arm:atlas-l}'s tail latency exceeds the budget everywhere except small talk",
      "takeaway": "Latency by task. Research is the slowest task because it includes a tool round trip.",
      "chart": {
        "kind": "bars",
        "title": "",
        "query": {
          "source": "tasks",
          "aspect": "",
          "measures": [
            "latency_s"
          ],
          "arms": [
            "atlas-m",
            "atlas-l",
            "brisk-s",
            "open-70b"
          ],
          "strata": [],
          "limit": 0,
          "transform": "none",
          "small_multiples_by": "task"
        },
        "reference": [],
        "emphasis": "",
        "level": "",
        "unit": "",
        "domain": []
      },
      "caption": "Measured end to end from user message to final token, in staging.",
      "caveats": []
    }
  ],
  "explore": [
    {
      "title": "Change the gates and see which plan wins",
      "controls": [
        {
          "id": "latency",
          "kind": "slider",
          "title": "Latency budget (p-ninety-five, seconds)",
          "binds": "p95",
          "min": 1.0,
          "max": 6.0,
          "step": 0.5,
          "default": 3.0,
          "options": []
        },
        {
          "id": "quality",
          "kind": "slider",
          "title": "Overall quality floor",
          "binds": "floor:overall",
          "min": 70.0,
          "max": 95.0,
          "step": 1.0,
          "default": 85.0,
          "options": []
        },
        {
          "id": "speculation",
          "kind": "toggle",
          "title": "Every routed model must pass the speculation gate",
          "binds": "floor:specul.declines",
          "min": 0.0,
          "max": 0.0,
          "step": 0.0,
          "default": 1.0,
          "options": []
        }
      ],
      "recomputes": "Which candidates pass each task and the cheapest routing plan; turning off the speculation requirement makes routing to the cheaper models win."
    }
  ],
  "full_results": [
    "arms_by_measure",
    "strata",
    "gate_matrix_full"
  ],
  "durable_claims": [
    {
      "text": "Small concierge models fail the speculation gate rather than overall quality, which blocks routing to them; judge agreement here was {judged.overall.agreement|pct}.",
      "confidence": "medium",
      "keys": [
        "judged.overall.agreement"
      ]
    }
  ],
  "answers": []
}
