{
  "mode": "decide",
  "headline_kind": "decision",
  "headline": "Select {arm:atlas-m}. It satisfies all quality gates and latency budgets at lower cost than {arm:atlas-l}.",
  "lede": "{arm:atlas-m} is the only evaluated model that meets every quality and p95 latency threshold across tasks. Lowering the p95 latency budget or accepting quality breaches on multi-turn tasks would be required to consider smaller candidates.",
  "decision": {
    "slots": [
      {
        "key": "recommendation",
        "text": "Adopt {arm:atlas-m} across all concierge flows.",
        "caveats": []
      },
      {
        "key": "why_not",
        "text": "{arm:atlas-l} breaches the p95 latency budget of {criteria.p95.threshold}s in multi-turn troubleshooting and research at substantially higher cost; {arm:open-70b} and {arm:brisk-s} breach multiple task quality floors.",
        "caveats": []
      },
      {
        "key": "watch",
        "text": "Weakest margin: {weakest.arm} achieves {weakest.value} against {weakest.criterion} at {weakest.threshold}, leaving a margin of {weakest.margin}. Monitor issue resolution on long multi-turn interactions.",
        "caveats": []
      },
      {
        "key": "next",
        "text": "Run a targeted trial of {arm:atlas-m} on live troubleshooting traffic to verify resolution rates under variable user turns.",
        "caveats": []
      }
    ],
    "confidence": {
      "form": "high",
      "caveats": []
    }
  },
  "method": [
    {
      "term": "Cases and repeats",
      "text": "Evaluated across {scoreboard.atlas-m.cases} distinct task scenarios with fixed prompts across all four model candidates.",
      "caveats": []
    },
    {
      "term": "Judge calibration",
      "text": "Quality dimensions judged with calibrated evaluator showing {judged.overall.agreement} agreement across {judged.overall.calibration_ratings} ratings.",
      "caveats": []
    },
    {
      "term": "Gates and budgets",
      "text": "Models must satisfy both task quality minimums and a p95 latency ceiling of {criteria.p95.threshold}s.",
      "caveats": []
    },
    {
      "term": "Cost basis",
      "text": "Costs computed from observed token consumption and published provider pricing per 1,000 replies.",
      "caveats": []
    }
  ],
  "schema": "report-plan/1",
  "signals": {
    "candidate_structure": "unordered",
    "baseline": "none",
    "score_type": "mixed",
    "strata": "tasks",
    "criteria": "hard_gates",
    "cross_cutting": [
      "specul"
    ],
    "log_cost_axis": false
  },
  "shape": "A",
  "masthead": {
    "kind": "Choice · candidates compared",
    "system": "Concierge chat assistant",
    "counts": "4 arms · 5 tasks",
    "run_date": "{meta.run_date}",
    "synthetic": true
  },
  "arms": [
    {
      "id": "atlas-l",
      "color_slot": 0
    },
    {
      "id": "atlas-m",
      "color_slot": 1
    },
    {
      "id": "brisk-s",
      "color_slot": 2
    },
    {
      "id": "open-70b",
      "color_slot": 3
    }
  ],
  "show_arms_key": false,
  "flag": [],
  "options": {
    "rows": [
      {
        "option": "atlas-m",
        "role": "recommended"
      },
      {
        "option": "atlas-l",
        "role": "near_miss"
      },
      {
        "option": "open-70b",
        "role": "alternative"
      },
      {
        "option": "brisk-s",
        "role": "cheapest"
      }
    ],
    "columns": [
      "gate"
    ]
  },
  "summary": [
    {
      "kind": "bars",
      "title": "Billing task cost comparison",
      "query": {
        "source": "tasks",
        "aspect": "",
        "measures": [
          "cost_per_1k"
        ],
        "arms": [
          "atlas-m",
          "atlas-l",
          "open-70b",
          "brisk-s"
        ],
        "strata": [
          "billing"
        ],
        "limit": 0,
        "transform": "none",
        "small_multiples_by": "none"
      },
      "reference": [],
      "emphasis": "atlas-m",
      "level": "",
      "unit": "",
      "domain": []
    },
    {
      "kind": "bars",
      "title": "Billing task latency comparison",
      "query": {
        "source": "tasks",
        "aspect": "",
        "measures": [
          "latency_s"
        ],
        "arms": [
          "atlas-m",
          "atlas-l",
          "open-70b",
          "brisk-s"
        ],
        "strata": [
          "billing"
        ],
        "limit": 0,
        "transform": "none",
        "small_multiples_by": "none"
      },
      "reference": [],
      "emphasis": "atlas-m",
      "level": "",
      "unit": "",
      "domain": []
    }
  ],
  "sections": [
    {
      "id": "gate_matrix",
      "eyebrow": "Gate compliance",
      "headline": "{arm:atlas-m} passes all gates while cheaper models fail quality floors",
      "takeaway": "Green cells indicate passing both quality floors and latency thresholds across evaluated domains.",
      "chart": {
        "kind": "gate_matrix",
        "title": "Task-level gate status by model",
        "query": {
          "source": "tasks",
          "aspect": "",
          "measures": [
            "overall"
          ],
          "arms": [
            "atlas-m",
            "atlas-l",
            "open-70b",
            "brisk-s"
          ],
          "strata": [],
          "limit": 0,
          "transform": "none",
          "small_multiples_by": "none"
        },
        "reference": [],
        "emphasis": "atlas-m",
        "level": "",
        "unit": "",
        "domain": []
      },
      "caption": "",
      "caveats": []
    },
    {
      "id": "latency_comparison",
      "eyebrow": "Latency constraints",
      "headline": "{arm:atlas-l} exceeds tail latency budgets in multi-turn tasks",
      "takeaway": "Bars show measured p95 response times compared against the budget limit.",
      "chart": {
        "kind": "bars",
        "title": "Tail latency in troubleshooting and research tasks",
        "query": {
          "source": "tasks",
          "aspect": "",
          "measures": [
            "latency_s"
          ],
          "arms": [
            "atlas-m",
            "atlas-l",
            "open-70b",
            "brisk-s"
          ],
          "strata": [
            "trouble",
            "research"
          ],
          "limit": 0,
          "transform": "none",
          "small_multiples_by": "task"
        },
        "reference": [],
        "emphasis": "atlas-m",
        "level": "",
        "unit": "",
        "domain": []
      },
      "caption": "",
      "caveats": []
    }
  ],
  "explore": [
    {
      "title": "Explore constraints",
      "controls": [
        {
          "id": "p95_budget",
          "kind": "slider",
          "title": "Latency budget (p95)",
          "binds": "p95",
          "min": 2.0,
          "max": 5.0,
          "step": 0.5,
          "default": 3.0,
          "options": []
        }
      ],
      "recomputes": "Adjusting the p95 latency budget shifts whether {arm:atlas-l} passes gates, but {arm:atlas-m} remains dominant on cost."
    }
  ],
  "full_results": [
    "arms_by_measure",
    "strata",
    "gate_matrix_full"
  ],
  "durable_claims": [
    {
      "text": "{arm:atlas-m} meets issue resolution at {task.trouble.atlas-m.resolves.mean}%, while {arm:atlas-l} reaches {task.trouble.atlas-l.latency_s.p95}s p95 latency.",
      "confidence": "high",
      "keys": [
        "task.trouble.atlas-m.resolves.mean",
        "task.trouble.atlas-l.latency_s.p95"
      ]
    }
  ],
  "answers": []
}
