{
  "mode": "decide",
  "headline_kind": "decision",
  "headline": "Deploy {arm:atlas-m}. It is the only model that clears every quality gate and latency budget.",
  "lede": "{arm:atlas-m} clears all eleven declared gates across tasks while operating well inside the latency budget. Cheaper models fail on multi-turn troubleshooting and research quality.",
  "decision": {
    "slots": [
      {
        "key": "recommendation",
        "text": "Adopt {arm:atlas-m} for the concierge chat assistant. It satisfies every quality floor and p95 latency limit across tasks.",
        "caveats": []
      },
      {
        "key": "why_not",
        "text": "{arm:atlas-l} breaches the latency budget in four of five tasks; {arm:brisk-s} and {arm:open-70b} fail multiple core quality gates.",
        "caveats": []
      },
      {
        "key": "watch",
        "text": "{weakest.arm} meets {weakest.criterion} at {weakest.value|pct} against the {weakest.threshold|pct} gate, leaving zero margin. A wider trial is needed to confirm troubleshooting resolution stability.",
        "caveats": []
      },
      {
        "key": "next",
        "text": "Run an expanded troubleshooting benchmark on {arm:atlas-m} with double the case count to ensure issue resolution stays above the floor.",
        "caveats": []
      }
    ],
    "confidence": {
      "form": "high",
      "caveats": []
    }
  },
  "method": [
    {
      "term": "Design & Scope",
      "text": "Choice comparison across four candidate models evaluated across five distinct task domains.",
      "caveats": []
    },
    {
      "term": "Judge Calibration",
      "text": "Overall quality evaluated via a calibrated judge with {judged.overall.calibration_ratings} ratings and {judged.overall.agreement|pct} agreement.",
      "caveats": []
    },
    {
      "term": "Gate Thresholds",
      "text": "Eleven hard gates were defined across tasks covering quality floors and latency budgets.",
      "caveats": []
    },
    {
      "term": "Cost Basis",
      "text": "Token usage priced at published list rates per 1,000 conversations.",
      "caveats": []
    }
  ],
  "schema": "report-plan/1",
  "signals": {
    "candidate_structure": "unordered",
    "baseline": "none",
    "score_type": "mixed",
    "strata": "tasks",
    "criteria": "hard_gates",
    "cross_cutting": [
      "specul"
    ],
    "log_cost_axis": true
  },
  "shape": "A",
  "masthead": {
    "kind": "Choice · candidates compared",
    "system": "Concierge chat assistant",
    "counts": "4 arms · 5 tasks",
    "run_date": "{meta.run_date}",
    "synthetic": true
  },
  "arms": [
    {
      "id": "atlas-l",
      "color_slot": 0
    },
    {
      "id": "atlas-m",
      "color_slot": 1
    },
    {
      "id": "brisk-s",
      "color_slot": 2
    },
    {
      "id": "open-70b",
      "color_slot": 3
    }
  ],
  "show_arms_key": false,
  "flag": [],
  "options": {
    "rows": [
      {
        "option": "atlas-m",
        "role": "recommended"
      },
      {
        "option": "atlas-l",
        "role": "near_miss"
      },
      {
        "option": "brisk-s",
        "role": "cheapest"
      },
      {
        "option": "open-70b",
        "role": "alternative"
      }
    ],
    "columns": [
      "gate",
      "cost_per_1k"
    ]
  },
  "summary": [
    {
      "kind": "bars",
      "title": "Cost per 1k conversations in Billing & account Q&A",
      "query": {
        "source": "tasks",
        "aspect": "",
        "measures": [
          "cost_per_1k"
        ],
        "arms": [
          "atlas-m",
          "atlas-l",
          "brisk-s",
          "open-70b"
        ],
        "strata": [
          "billing"
        ],
        "limit": 0,
        "transform": "none",
        "small_multiples_by": "none"
      },
      "reference": [],
      "emphasis": "atlas-m",
      "level": "",
      "unit": "",
      "domain": []
    },
    {
      "kind": "bars",
      "title": "Latency in Billing & account Q&A",
      "query": {
        "source": "tasks",
        "aspect": "",
        "measures": [
          "latency_s"
        ],
        "arms": [
          "atlas-m",
          "atlas-l",
          "brisk-s",
          "open-70b"
        ],
        "strata": [
          "billing"
        ],
        "limit": 0,
        "transform": "none",
        "small_multiples_by": "none"
      },
      "reference": [],
      "emphasis": "atlas-m",
      "level": "",
      "unit": "",
      "domain": []
    }
  ],
  "sections": [
    {
      "id": "gate_status",
      "eyebrow": "Gate compliance",
      "headline": "{arm:atlas-m} is the sole candidate to pass every gate across all tasks.",
      "takeaway": "Green cells show passing criteria; {arm:atlas-l} breaches latency limits while {arm:brisk-s} and {arm:open-70b} miss accuracy thresholds.",
      "chart": {
        "kind": "gate_matrix",
        "title": "",
        "query": {
          "source": "tasks",
          "aspect": "",
          "measures": [],
          "arms": [
            "atlas-m",
            "atlas-l",
            "open-70b",
            "brisk-s"
          ],
          "strata": [],
          "limit": 0,
          "transform": "none",
          "small_multiples_by": "none"
        },
        "reference": [],
        "emphasis": "atlas-m",
        "level": "",
        "unit": "",
        "domain": []
      },
      "caption": "",
      "caveats": []
    }
  ],
  "explore": [
    {
      "title": "Explore gate tolerances",
      "controls": [
        {
          "id": "p95_threshold",
          "kind": "slider",
          "title": "Latency budget (p95)",
          "binds": "p95",
          "min": 1.0,
          "max": 5.0,
          "step": 0.5,
          "default": 3.0,
          "options": []
        }
      ],
      "recomputes": "Moving the latency budget slider does not promote {arm:brisk-s} or {arm:open-70b}, which remain blocked by quality failures."
    }
  ],
  "full_results": [
    "arms_by_measure",
    "strata",
    "gate_matrix_full"
  ],
  "durable_claims": [
    {
      "text": "{arm:atlas-m} meets Resolves the issue at {criteria.trouble.resolves.atlas-m.value|pct} against the {criteria.trouble.resolves.threshold|pct} gate.",
      "confidence": "high",
      "keys": [
        "criteria.trouble.resolves.atlas-m.value",
        "criteria.trouble.resolves.threshold"
      ]
    }
  ],
  "answers": []
}
